Session title,Speakers,When?
Invited Session 1 (3 talks),Thomas Berrett; Timothy Cannings; Jean Feng,Thursday AM
Invited Session 2 (3 talks),Nicole Pashley; José R. Zubizarreta; Jelena Bradic,Thursday PM
Invited Session 3 (4 talks),Yuhua Zhu; Yichen Zhang; Annie Qu; Lan Wang,Thursday PM
Invited Session 4 (3 talks),Yi Yu; Yuqi Gu,Friday AM
Invited Session 5 (3 talks),Cynthia Rush; Alessandro Rinaldo; Jane-Ling Wang,Friday PM
Invited Session 6 (3 talks),Miaoyan Wang; Snigdha Panigrahi; Damla Senturk,Friday PM
Invited Session 7 (3 talks),Yaniv Romano; Zhimei Ren; Anna Neufeld,Saturday AM
Invited Session 8 (4 talks),Jingyi Jessica Li; Lan Gao; Jose Angel Sanchez Gomez; Ana Maria Kenney,Saturday AM
